<?xml version="1.0" encoding="UTF-8"?>
<alumnos xmlns:xsi="http://www.w3.org/2001/XMLSchema-instance" xsi:noNamespaceSchemaLocation="alumnos3.xsd">
	<alumno curso="23-24">
		<expediente>11111</expediente>
		<nombre>carlitos</nombre>
		<edad>21</edad>
	</alumno>
	<alumno curso="24-25">
		<expediente>22222</expediente>
		<nombre>menganito</nombre>
		<edad>28</edad>
	</alumno>
	<alumno curso="24-25" IES="Ciudad Escolar">
		<expediente>33333</expediente>
		<nombre>fermin</nombre>
		<edad>24</edad>
	</alumno>
	<alumno curso="24-25">
		<expediente>44444</expediente>
		<nombre>julito</nombre>
		<edad>23</edad>
	</alumno>
</alumnos>

